"NO","SubNo","スキルカテゴリ","スキルレベル","サブカテゴリ","チェック項目","BZ","DS","必須スキル"
1,1,"環境構築","★","システム企画","オープンデータを収集して活用する分析システムの要件を整理できる","","",""
2,2,"環境構築","★★","システム企画","数千万レコードの大容量データを蓄積・分析するシステムにおいて、データの重要性や分析要件に則したシステム構築、初期データ投入方法、システム運用の要件定義が行える","","","◯"
3,3,"環境構築","★★","システム企画","ソフトウェア開発プロジェクトの管理方法、設計、テスト方法を理解した上で、データ管理・分析システムの要件定義を行うことができる","","",""
4,4,"環境構築","★★★","システム企画","組織の情報システム戦略、全体システム化計画の方針に従い、全体最適の観点を持って、データ分析システムの企画・要件定義を推進できる","＊","",""
5,5,"環境構築","★★★","システム企画","データ活用戦略を正しく理解し、各種業務プロセスについての専門知識とシステムに関する知識を有し、双方を活用して、適切な要件定義が行える","＊","","◯"
6,6,"環境構築","★★★","システム企画","プライベートネットワーク上の内部データ（CRM、Webログ、ユーザー購買データなど）とインターネット上データ（気象データ、為替変動データなど）の仕様を理解し、両方のデータソースを統合する要件を整理できる","＊","",""
7,7,"環境構築","★★★","システム企画","オンプレミス環境もしくはIaaS上の分析システムにおいて業務要件やリソース負荷に応じて、データフローや管理機構の統合、またバッチ実行スケジュールの最適化について要件定義が行える","","",""
8,8,"環境構築","★","システム設計","サーバー1～10台規模のシステム構築、システム運用を手順書を元に実行できる","","",""
9,9,"環境構築","★","システム設計","オンプレミス環境もしくはIaaS上のデータベースに格納された分析データのバックアップやアーカイブ作成などの定常運用ができる","","",""
10,10,"環境構築","★★","システム設計","オンプレミス環境もしくはIaaS上の分析システムにおけるシステム運用（監視、フェイルオーバー、バックアップ、リカバリー処理、サービス開始・停止処理など）の運用設計や手順書作成が行える","","",""
11,11,"環境構築","★★","システム設計","HTTPを活用したオープンAPIと分析システムのサーバー環境及びデータベースの連携設計ができる","","",""
12,12,"環境構築","★★","システム設計","既存システムの各機能が参照・更新するデータの構造や関連付けを把握し、分析機能の追加や改修時にデータモデルの見直しが必要か判断できる","＊","","◯"
13,13,"環境構築","★★","システム設計","分析実行頻度の少ないシステムにおいて、分析非稼働時にはサービス削除し、必要時のみサービスを有効にすることでクラウドコストを最小化するシステム運用を設計できる","","",""
14,14,"環境構築","★★","システム設計","クラウドの運用管理サービスを利用して、クラウド上に構築した分析システムの監視やバックアップ等のシステム運用を実装できる","","",""
15,15,"環境構築","★★★","システム設計","オンプレミス環境における分析システムのキャパシティ要件（データ容量）と必要処理性能（スループット）を定義できる","","",""
16,16,"環境構築","★★★","システム設計","クラウドのメリットとデメリットを比較して、必要に応じてオンプレミスのデータ分析システムをクラウド環境に移行できる","","",""
17,17,"環境構築","★★★","システム設計","オンプレミス環境における大容量データストアに対して適切なデータ分散配置なども含めてシステム拡張方法や最適化の要件を整理できる","","",""
18,18,"環境構築","★★★","システム設計","扱うデータのデータ規模や機密性、分析要件を理解した上で、オンプレミスで構築するか、クラウド上で構築するかの要件を整理できる","","","◯"
19,19,"環境構築","★","アーキテクチャ設計","ノーコード・ローコードツールを組み合わせ、要件に応じたアプリやツールを設計できる","","",""
20,20,"環境構築","★","アーキテクチャ設計","コンテナ技術の概要を理解しており、既存のDockerイメージを活用して効率的に分析環境を構築できる","","",""
21,21,"環境構築","★","アーキテクチャ設計","分析環境を提供するクラウド上のマネージドサービス(Amazon SageMaker、Azure Machine Learning、Google Cloud Vertex AI、IBM Watson Studioなど)を利用して、機械学習モデルを開発できる","","",""
22,22,"環境構築","★★","アーキテクチャ設計","分析者向けのRDBMS、NoSQL、ETL、Visualizationなど単一コンポーネントのユーザー利用機能の設計が行える","","","◯"
23,23,"環境構築","★★","アーキテクチャ設計","深層学習（ディープラーニング）の学習を高速化するために、GPU（GPGPU）環境を実装できる","","",""
24,24,"環境構築","★★","アーキテクチャ設計","Dockerコンテナ技術を用いてデータの蓄積環境・分析環境を構築し、再利用できる形でDockerイメージを管理できる","","",""
25,25,"環境構築","★★","アーキテクチャ設計","コンテナオーケストレーションツール（Kubernetes、OpenShift、Amazon Elastic Container Serviceなど）を用いて複数のコンテナの配置と実行を管理できる","","",""
26,26,"環境構築","★★","アーキテクチャ設計","開発した予測モデルをREST APIから呼び出せるように実装し、マイクロサービスのコンポーネントの一つとしてシステムに組み込むことができる","","",""
27,27,"環境構築","★★","アーキテクチャ設計","自社のオンプレミス環境とプライベートクラウド環境を専用線やVPNを用いて接続し、オンプレミス環境上のデータをクラウド上のデータストアサービスにインターネットを介さず安全に格納するネットワークを設計できる","","",""
28,28,"環境構築","★★★","アーキテクチャ設計","量子コンピュータにおけるロジックを検討する際に計算結果のゆらぎについて理解した上で、適切な処理フローやテスト手順を検討できる","","",""
29,29,"環境構築","★★★","アーキテクチャ設計","量子コンピュータの量子計算の特徴や制約を理解し、量子コンピュータの計算性能を生かすユースケースを検討できる","","",""
30,30,"環境構築","★★★","アーキテクチャ設計","オンプレミス環境の物理サーバ上にHadoopやSparkなどを組み合わせて大容量データを管理する分散管理システムを設計できる","","",""
31,31,"環境構築","★★★","アーキテクチャ設計","KVS、カラム指向、ドキュメント指向などデータ構造の異なる複数のシステムからデータ取得と分析環境への連携を設計できる","","",""
32,32,"環境構築","★★★","アーキテクチャ設計","費用対効果が高いPaaS型サービスと設計自由度の高いIaaS環境のメリット、デメリットを理解し、PaaSとIaaSを組み合わせた効率的な分析システムを設計できる","","",""
33,33,"環境構築","★★★","アーキテクチャ設計","Amazon Web Services（AWS)、Microsoft Azure、Google Cloud、IBM Cloudなど複数社のクラウドサービスを組み合わせたマルチクラウド構成を設計し、各社が提供する固有の分析サービスを連携して活用することができる","","",""
34,1,"データ収集","★","クライアント技術","対象プラットフォーム（クラウドサービス、分析ソフトウェア）が提供する機能（SDKやAPIなど）の概要を説明できる","","",""
35,2,"データ収集","★","クライアント技術","Webクローラー・スクレイピングツールを用いてWebサイト上の静的コンテンツを分析用データとして収集できる","","",""
36,3,"データ収集","★★","クライアント技術","対象プラットフォーム（IoTデバイス、スマートフォン、クラウドサービスなど）で取得可能なデータ項目から目的に応じてデータ収集システムを設計できる","","",""
37,4,"データ収集","★★","クライアント技術","エッジコンピューティング構成においてエッジデバイス側（端末側）で収集したログを、適切なタイミングでサーバ側に転送・集約するデータ収集の仕組みを設計できる","＊","",""
38,5,"データ収集","★★★","クライアント技術","センター側で学習した予測モデルを、ネットワーク経由でエッジデバイスに配信して、エッジデバイス側で予測・分析を行うエッジAIシステムを設計できる","＊","",""
39,6,"データ収集","★","通信技術","システムやネットワーク機器に用意された通信機能（HTTP、FTPなど）を用い、データを収集先に格納するための機能を実装できる","","",""
40,7,"データ収集","★★","通信技術","データ収集対象の要件に応じて、MQTT（Message Queue Telemetry Transport）によるパブリッシュ/サブスクライブ型の通信を検討・実装できる","","",""
41,8,"データ収集","★★","通信技術","既存のデータ収集システムの通信回線を5GやLPWA(Low Power Wide Area)など既存と異なる通信規格に変更することにより発生する影響を評価できる","","",""
42,9,"データ収集","★★","通信技術","ネットワークプロトコルや暗号化などの通信技術を用い、通信のボトルネックと可用性（継続的に通信が成立していること）を考慮した上で、必要な通信機能を実装できる","","",""
43,10,"データ収集","★★★","通信技術","自動車の自動運転やドローン操縦で使用される無線通信網の特性や制約を理解して、移動体から取得するデータや取得方式を設計できる","","",""
44,11,"データ収集","★★★","通信技術","データ通信において、機能・性能の問題に対し根本原因を特定できるだけでなく、必要に応じて新規技術の適用を検討できる","","",""
45,12,"データ収集","★","データ抽出","データベースから何らかのデータ抽出方法を活用し、小規模なExcelのデータセットを作成できる","","","◯"
46,13,"データ収集","★","データ収集","既存のサービスやアプリケーションに対して、分析をするためのログ出力の仕様を整理することができる","＊","＊",""
47,14,"データ収集","★★","データ収集","FluentdやLogstashなどのログ収集ツールを用いて形式の異なる複数サーバのログを収集し分析可能な形式に変換して蓄積することができる","","",""
48,15,"データ収集","★★★","データ収集","GDPRや個人情報保護法を理解し、ユーザからの削除申請があった場合はユーザに関連する全ての情報を一括消去する機能を設計できる","＊","",""
49,16,"データ収集","★★★","データ収集","入手可能なデータに加え、分析結果の品質・効果を向上させる新たなデータ入手方法を提案できる（IoTでの新設センサーの種類、配置場所、データ入手間隔など）","＊","＊","◯"
50,17,"データ収集","★★","データ統合","データフォーマットの異なる同一内容のデータ（会員情報、商品マスタなど）を統合する処理を設計できる","","","◯"
51,18,"データ収集","★★★","データ統合","組織統合などにより異なるコード定義やフォーマットが混在する複数システムのデータを統合し利活用するシステムを設計できる","＊","",""
52,19,"データ収集","★★★","データ統合","システム分析・業務分析をもとに、必要なデータフロー管理やジョブ管理などのツールを選定・評価できる","","","◯"
53,1,"データ構造","★","基礎知識","扱うデータが、構造化データ（顧客データ、商品データ、在庫データなど）か非構造化データ（雑多なテキスト、音声、画像、動画など）なのかを判断できる","","","◯"
54,2,"データ構造","★","基礎知識","ER図を読んでテーブル間のリレーションシップを理解できる","","","◯"
55,3,"データ構造","★★","要件定義","業務で使用するデータのライフサイクル（いつ、どんなデータが発生し、いつまで保持されているのかなど）を把握して、論理モデルを作成できる","＊","","◯"
56,4,"データ構造","★★","要件定義","データ保持ルール（データアクセス、性能、保持期間、セキュリティなど）に基づき、データベース・DWHの運用ルールを定義できる","","",""
57,5,"データ構造","★","テーブル定義","正規化手法（第一正規化～第三正規化）を用いてテーブルを正規化できる","","",""
58,6,"データ構造","★★","テーブル定義","ビジネスプロセスを理解・整理して、データフロー図、論理データモデル、ER図、テーブル定義書を作成できる","＊","","◯"
59,7,"データ構造","★★","テーブル定義","業務特性や基幹システムの特徴をもとに、検索で頻繁に使用するデータのキー（顧客IDなど）を想定し、インデックスを作成・設定できる","＊","",""
60,8,"データ構造","★★","テーブル定義","データ集計を高速化またはSQLを単純化するため、スタースキーマ、スノーフレークスキーマなどを用いたデータモデルを設計できる","","",""
61,9,"データ構造","★★","テーブル設計","稼働中の複数のシステム間で発生するデータ項目の差異を、変換テーブルを活用して、埋めることができる","","",""
62,10,"データ構造","★★","テーブル設計","DWHに入れる元データ（基幹DBのデータなど）のキーに変更があった場合に、サロゲートキーやナビゲーションブリッジテーブルを用いて対応できる","","",""
63,11,"データ構造","★★","テーブル設計","非正規化テーブルや一時テーブルなどを作成し、アプリケーションの処理速度を高速化できる","","",""
64,1,"データ蓄積","★","DWH","DWHアプライアンス（Oracle Exadata Database Machine、IBM Integrated Analytics Systemなど）に接続し、複数テーブルを結合したデータを抽出できる","","",""
65,2,"データ蓄積","★★","DWH","DWHアプライアンス（Oracle Exadata Database Machine、IBM Integrated Analytics Systemなど）の機能と特徴を理解し、適切な管理対象データを選定できる","","",""
66,3,"データ蓄積","★","分散技術","HadoopやSparkの分散技術の基本的な仕組みと構成を理解している","","",""
67,4,"データ蓄積","★","分散技術","NoSQLデータストア（HBase、Cassandra、Mongo DB、CouchDB、Amazon DynamoDB、Azure Cosmos DB、Google Cloud Firestoreなど）にAPIを介してアクセスし、新規データを登録できる","","",""
68,5,"データ蓄積","★★","分散技術","HadoopやSparkのメリット・デメリットを理解し、HadoopやSparkにて管理すべきデータを選定できる","","",""
69,6,"データ蓄積","★★","分散技術","KVSの特性（集計・ソートが苦手、データの一貫性保証など）を理解し、KVSがデータストア要件を満たすかを判断できる","","",""
70,7,"データ蓄積","★★★","分散技術","HadoopやSparkの分散アーキテクチャを理解し、大容量データ処理の設計やパフォーマンスチューニングができる","","",""
71,8,"データ蓄積","★","クラウド","クラウド上のオブジェクトストレージサービス（Amazon S3、Azure Blob Storage、Google Cloud Storage、IBM Cloud Object Storageなど）に接続しデータを格納できる","","","◯"
72,9,"データ蓄積","★★","クラウド","クラウド上のDWHサービス（Amazon Redshift、Google BigQuery、IBM Db2 Warehouse、Azure Synapse Analytics等）にロードして分析で利用できる","","",""
73,10,"データ蓄積","★★★","クラウド","クラウド上のデータストアサービスが対象システムの機能要件・非機能要件に合致するか評価を行い、採用可否を判断できる","","",""
74,11,"データ蓄積","★★★","リアルタイム処理","リアルタイムに入力されるストリームデータから指定条件のイベントを即時に抽出する複合イベント処理（CEP）を実現するサーバー環境・構成を設計できる","","",""
75,12,"データ蓄積","★★★","リアルタイム処理","Apache Kafka 、Apache Storm、Apache Flinkなどのストリーム処理プラットフォームを活用して、入力データをリアルタイムに処理して連携できる","","",""
76,13,"データ蓄積","★★★","リアルタイム処理","適切なライブラリや実行環境を選択して、ストリーム処理やイベント駆動アプリケーションを実装できる","","",""
77,14,"データ蓄積","★★★","キャッシュ技術","基盤設計において、どこのシステム要素にRedisやmemcachedなどのキャッシュ機能を採用すると処理が高速化されるか判断できる","","",""
78,15,"データ蓄積","★★","データ蓄積技術","データストア選定の際にリレーショナルDBだけでなく、要件に応じてNoSQL、時系列DB、グラフDB、ベクトルDBなどの適切なデータ蓄積機能を選定できる","","",""
79,16,"データ蓄積","★★★","検索技術","Apache Solr、Elasticsearch、OpenSearchなどの全文検索エンジンを用いて、テキストキーワードやログの検索用DBを構築することができる","","",""
80,1,"データ加工","★","フィルタリング処理","表計算ソフトのデータファイルに対して、条件を指定してフィルタリングできる（特定値に合致する・もしくは合致しないデータの抽出、特定範囲のデータの抽出、部分文字列の抽出など）","","","◯"
81,2,"データ加工","★","フィルタリング処理","正規表現を活用して条件に合致するデータを抽出できる（メールアドレスの書式を満たしているか判定をするなど）","","",""
82,3,"データ加工","★","ソート処理","表計算ソフトのデータファイルに対して、目的の並び替えになるように複数キーのソート条件を設定ができる ","","","◯"
83,4,"データ加工","★","結合処理","表計算ソフトのデータファイルに対して、単一条件による内部結合、外部結合、自己結合ができ、UNION処理ができる","","","◯"
84,5,"データ加工","★","前処理","表計算ソフトのデータファイルに対して、NULL値や想定外・範囲外のデータを持つレコードを取り除く、または既定値に変換できる","","","◯"
85,6,"データ加工","★★","前処理","フラットファイルやバイナリファイルに対するデータロードの前処理（クレンジング操作、禁則処理やバイナリ処理）ができる","","",""
86,7,"データ加工","★★","前処理","線形補間など、複数のレコードを考慮したクレンジング処理ができる","","",""
87,8,"データ加工","★","マッピング処理","表計算ソフトのデータファイルに対して、規定されたリストと照合して変換する、都道府県名からジオコードに変換するなど、ある値を規定の別の値で表現できる","","","◯"
88,9,"データ加工","★★","マッピング処理","データ定義や実際の観測データの状況をもとに、一般的な名寄せ処理を設計・実装できる","","",""
89,10,"データ加工","★","サンプリング処理","表計算ソフトのデータファイルに対して、ランダムまたは一定間隔にレコードを抽出できる","","","◯"
90,11,"データ加工","★","集計処理","表計算ソフトのデータファイルのデータを集計して、合計や最大値、最小値、レコード数を算出できる","","","◯"
91,12,"データ加工","★","変換・演算処理","表計算ソフトのデータファイルのデータに対する四則演算ができ、数値データを日時データに変換するなど別のデータ型に変換できる","","","◯"
92,13,"データ加工","★","変換・演算処理","変換元データと変換先データの文字コードが異なる場合、変換処理のコードがかける","","",""
93,14,"データ加工","★★","変換・演算処理","数十億レコードの大容量データに対して効率的な処理を行うために、Parquetなどのカラムナ（列指向）ストレージ形式のファイルに変換してデータを管理できる","","",""
94,15,"データ加工","★★","変換・演算処理","手書き文字や画像などの非構造データを、OCRや画像認識ライブラリ、画像認識モデルなどを用いて分析可能な構造化データに変換できる","","＊",""
95,1,"データ共有","★","データ出力","加工・分析処理結果をCSV、XML、JSON、Excelなどの指定フォーマット形式に変換してエクスポートできる","","","◯"
96,2,"データ共有","★","データ出力","加工・分析処理結果を、接続先DBのテーブル仕様に合わせてレコード挿入できる","","","◯"
97,3,"データ共有","★","データ展開","RESTやSOAPなどのデータ取得用Web APIを用いて、必要なデータを取得できる","","",""
98,4,"データ共有","★★","データ展開","利用者の要件に合致したレポート（図、表）を、PDFやPostScriptなどの印刷用フォーマットで出力する変換機能を設計できる","","",""
99,5,"データ共有","★★","データ展開","BIツール用のサーバーを構築し、単一データソースのレポート用データマートを設計・構築できる","","",""
100,6,"データ共有","★★","データ展開","データストア上のデータをメールやメッセージを用いてプッシュ配信するシステムのサーバー・ネットワーク・ソフトウェアの構成を設計できる","","",""
101,7,"データ共有","★★","データ展開","Webアプリケーションの実装において、WebSocketを用いてクライアント側にリアルタイムにデータ提供できる機能を設計できる","","",""
102,8,"データ共有","★★","データ展開","RSSや業界標準フォーマットなど要件に合致したデータ形式・配信形式で、情報提供するシステムのインターフェースを設計できる","","",""
103,9,"データ共有","★★","データ展開","RESTやSOAPなどのWeb APIを用いて、必要なデータを提供するシステムの公開インターフェースを設計できる","","",""
104,10,"データ共有","★","データ連携","FTPサーバー、ファイル共有サーバーなどから必要なデータファイルをダウンロードして、Excelなどの表計算ソフトに取り込み活用できる","","","◯"
105,11,"データ共有","★","データ連携","BIツールからデータベース上のDBテーブルを参照して新規レポートやダッシュボードを作成し、指定のユーザグループに公開できる","＊","＊",""
106,12,"データ共有","★","データ連携","BIツールの自由検索機能を活用し、必要なデータを抽出して、グラフを作成できる","＊","＊",""
107,13,"データ共有","★★","データ連携","連携対象システムの仕様に合わせて、ETLツールを用いたデータ変換、ファイル転送処理を実装できる","","",""
108,14,"データ共有","★★★","データ連携","他データや他システム連携を容易にする目的で、適切なオープンデータ系の標準フォーマット（IMI：Infrastructure for Multilayer Interoperability[情報共有基盤]に記載のデータモデルや、GTFS：General Transit Feed Specificationなど）を用いて、データモデルを設定できる","","",""
