"NO","SubNo","スキルカテゴリ","サブカテゴリ","スキルレベル","チェック項目","BZ","DE","必須スキル"
1,1,"基礎数学","線形代数基礎","★","ベクトルの内積に関する計算方法を理解し、線形式をベクトルの内積で表現できる","","","◯"
2,2,"基礎数学","線形代数基礎","★","行列同士、および行列とベクトルの計算方法を正しく理解し、複数の線形式を行列の積で表現できる","","","◯"
3,3,"基礎数学","線形代数基礎","★","逆行列の定義、および逆行列を求めることにより行列表記された連立方程式が解けることを理解している","","",""
4,4,"基礎数学","線形代数基礎","★","固有ベクトルおよび固有値の意味を理解している","","",""
5,5,"基礎数学","微分・積分基礎","★","微分により計算する導関数が傾きを求めるための式であることを理解している","","","◯"
6,6,"基礎数学","微分・積分基礎","★","2変数以上の関数における偏微分の計算方法を理解している","","",""
7,7,"基礎数学","微分・積分基礎","★","積分と面積の関係を理解し、確率密度関数を定積分することで確率が得られることを説明できる","","","◯"
8,8,"基礎数学","集合論基礎","★","和集合、積集合、差集合、対称差集合、補集合についてベン図を用いて説明できる","","","◯"
9,9,"基礎数学","集合論基礎","★","論理演算と集合演算の対応を理解している（ANDが積集合に対応するなど）","","",""
10,1,"基礎数学","統計数理基礎","★","順列や組合せの式 nPr, nCr を理解し、適切に使い分けることができる","","","◯"
11,2,"基礎数学","統計数理基礎","★","確率に関する基本的な概念の意味を説明できる（確率、条件付き確率、期待値、独立など）","","","◯"
12,3,"基礎数学","統計数理基礎","★","平均、中央値、最頻値の算出方法の違いを説明できる","","","◯"
13,4,"基礎数学","統計数理基礎","★","与えられたデータにおける分散、標準偏差、四分位、パーセンタイルを理解し、目的に応じて適切に使い分けることができる","","","◯"
14,5,"基礎数学","統計数理基礎","★","母（集団）平均と標本平均、不偏分散と標本分散がそれぞれ異なることを説明できる","","","◯"
15,6,"基礎数学","統計数理基礎","★","標準正規分布の平均と分散の値を知っている","","","◯"
16,7,"基礎数学","統計数理基礎","★","相関関係と因果関係の違いを説明できる","","","◯"
17,8,"基礎数学","統計数理基礎","★","名義尺度、順序尺度、間隔尺度、比例尺度の違いを説明できる","","","◯"
18,9,"基礎数学","統計数理基礎","★","ピアソンの相関係数の分母と分子を説明できる","","","◯"
19,10,"基礎数学","統計数理基礎","★","５つ以上の代表的な確率分布を説明できる","","","◯"
20,11,"基礎数学","統計数理基礎","★","二項分布は試行回数が増えていくとどのような分布に近似されるかを知っている","","","◯"
21,12,"基礎数学","統計数理基礎","★","変数が量的、質的どちらの場合でも関係の強さを算出できる","","","◯"
22,13,"基礎数学","統計数理基礎","★","指数関数とlog関数の関係を理解し、片対数グラフ、両対数グラフ、対数化されていないグラフを適切に使いわけることができる","","","◯"
23,14,"基礎数学","統計数理基礎","★","ベイズの定理を説明できる","","","◯"
24,15,"基礎数学","統計数理基礎","★★","ベイズ推論が学習や予測、モデル評価などをすべて確率分布上の計算問題として扱っていることにより、これらの要素を確率分布として扱わない手法と比べ、どのようなメリットを生み出しているか理解している","","",""
25,16,"基礎数学","統計数理基礎","★★","自己情報量やエントロピーの意味について説明できる","","",""
26,17,"基礎数学","統計数理基礎","★★","カルバック・ライブラー情報量（KL divergence）、フィッシャー情報量の意味や利用方法について説明できる","","",""
27,18,"基礎数学","統計数理基礎","★★","尤度と最尤推定についての説明ができる（尤度関数、ネイマンの分解定理、十分統計量）","","",""
28,19,"意味合いの抽出、洞察","洞察","★","分析、図表から直接的な意味合いを抽出できる（バラツキ、有意性、分布傾向、特異性、関連性、変曲点、関連度の高低など）","＊","","◯"
29,20,"意味合いの抽出、洞察","洞察","★","想定に影響されず、分析結果の数値を客観的に解釈できる","＊","",""
30,21,"意味合いの抽出、洞察","洞察","★★","各種の解析手法（主成分分析、クラスター分析、決定木分析など）の結果を解釈し、意味合いを適切に表現・説明できる","＊","","◯"
31,22,"性質・関係性の把握","性質・関係性の把握","★","適切なデータ区間設定でヒストグラムを作成し、データのバラつき方を把握できる","＊","","◯"
32,23,"性質・関係性の把握","性質・関係性の把握","★","適切な軸設定でクロス集計表を作成し、属性間のデータの偏りを把握できる","＊","","◯"
33,24,"性質・関係性の把握","性質・関係性の把握","★","量的変数の散布図を描き、2変数の関係性を把握できる","","","◯"
34,25,"性質・関係性の把握","性質・関係性の把握","★★","多重（質問間）クロス集計表などを駆使して、データから適切なインサイトを得ることができる（データの偏りの発見や独立性の検定など）","＊","",""
35,26,"性質・関係性の把握","性質・関係性の把握","★★","主成分分析と因子分析の違いや使い分けを説明し、実施できる","","",""
36,27,"性質・関係性の把握","性質・関係性の把握","★★","正準相関分析を説明し、実施できる","","",""
37,28,"性質・関係性の把握","性質・関係性の把握","★★","因子分析における、因子負荷量の意味を理解し、因子軸の回転（プロマックス回転、バリマックス回転など）について実施できる","","",""
38,29,"性質・関係性の把握","性質・関係性の把握","★★","コレスポンデンス（対応）分析と数量化III類を説明し、実施できる","","",""
39,30,"性質・関係性の把握","性質・関係性の把握","★★","コンジョイント分析を自ら設計し、効用値と寄与率からモデルを評価できる","","",""
40,31,"性質・関係性の把握","性質・関係性の把握","★★","適切な類似度を設定した上で、多次元尺度構成法を用いてポジショニングマップを描くことができる","＊","",""
41,32,"性質・関係性の把握","性質・関係性の把握","★★","空間的自己相関の手法を用いて空間的な類似性を数値化できる","","",""
42,33,"性質・関係性の把握","性質・関係性の把握","★★","行列分解（非負値行列因子分解[Nonｰnegative Matrix Factorization:NMF]、特異値分解）を、目的に応じてパラメータを最適化して分析できる","","",""
43,34,"性質・関係性の把握","性質・関係性の把握","★★★","テンソル分解（非負値テンソル因子分解[Non-negative Tensor Factorization:NTF]、CP分解[Canonical Polyadic Decomposition:CPD]、Tucker分解など）を、対象データの特性や目的に応じて適用する事で、より複合的な要因の性質や関係性を分析できる","","",""
44,35,"推定・検定","推定・検定","★","点推定と区間推定の違いを説明できる","","",""
45,36,"推定・検定","推定・検定","★","統計的仮説検定において帰無仮説と対立仮説の違いを説明できる","","",""
46,37,"推定・検定","推定・検定","★","第1種の過誤、第2種の過誤、p値、有意水準の意味を説明できる","","",""
47,38,"推定・検定","推定・検定","★","片側検定と両側検定の違いを説明できる","","",""
48,39,"推定・検定","推定・検定","★","検定する対象となるデータの対応の有無を考慮した上で適切な検定手法（t検定, z検定など）を選択し、適用できる","","",""
49,40,"推定・検定","推定・検定","★★","検定力やサンプルサイズ、分布など対象のデータを考慮したうえで適切な検定手法を選択し、結果を評価できる（パラメトリックな多群の検定、クラスカル・ウォリス検定、カイ二乗検定など）","","",""
50,41,"推定・検定","推定・検定","★★","p値だけでは仮説やモデルの正しさを評価できないことを理解し、p値以外のアプローチ（信頼区間、信用区間、ベイズファクターなど）と併せて透明性の高いデータ分析や結果の報告ができる","＊","","◯"
51,42,"パターン発見","パターン発見","★","条件Xと事象Yの関係性を信頼度、支持度、リフト値を用いて評価できる","","",""
52,43,"パターン発見","パターン発見","★★","アプリオリアルゴリズムのアソシエーション分析において、パラメータをチューニングして出力件数を調整できる","","",""
54,46,"性質・関係性の把握","因果推論","★","ある変数が他の変数に与える影響（因果効果）を推定したい場合、その双方に影響を与える共変量（交絡因子）の考慮が重要であると理解している（喫煙の有無と疾病発症の双方に年齢が影響している場合など）","","",""
55,47,"性質・関係性の把握","因果推論","★","分析の対象を定める段階で選択バイアスが生じる可能性があることを理解している（途中離脱者の除外時、欠損データの除外時など）","","","◯"
57,48,"性質・関係性の把握","因果推論","★★","統計的因果推論における因果効果（平均処置効果、Average Treatment Effect; ATEなど）について説明できる","","",""
58,49,"性質・関係性の把握","因果推論","★★","統計的因果推論における、強く無視できる割り当て条件（Conditional Exchangeability）を説明できる","","",""
59,50,"性質・関係性の把握","因果推論","★★","ある変数の影響（因果効果）を推定したいがランダム化比較試験の実施が難しい場合、傾向スコアによる手法（傾向スコアマッチング、IPW、Doubly Robustなど）を用いることで観測されている共変量の影響を最小限に抑えることができる","","",""
61,1,"データの理解・検証","データ確認","★","単独のグラフに対して、集計ミスや記載ミスなどがないかチェックできる","＊","","◯"
62,2,"データの理解・検証","データ確認","★","データ項目やデータの量・質について、指示のもと正しく検証し、結果を説明できる","＊","",""
63,3,"データの理解・検証","データ確認","★★","複数のグラフや集計表で構成されているレポートに対して、全体として集計ミスや不整合が起きていないかチェックできる","＊","","◯"
64,4,"データの理解・検証","データ確認","★★","データ項目やデータの量・質の検証方法を計画・実行し、その結果をもとにその後の分析プロセスを立案・修正できる","＊","",""
65,5,"データの理解・検証","データ確認","★★★","多数のグラフ、集計表、外部の統計情報、高度なデータ解析手法を用いた解析結果などを含むレポートに対して、不整合が起きていないか、妥当性の高い論理構造であるかチェックできる","＊","",""
66,6,"データの理解・検証","データ確認","★★★","分析に必要なデータを想定し、現在取得可能なデータの量・質で分析に耐えうるか、分析目的が達成可能であるかを判断できる","＊","","◯"
67,7,"データの理解・検証","俯瞰・メタ思考","★","データが生み出された背景を考え、鵜呑みにはしないことの重要性を理解している","＊","",""
68,8,"データの理解・検証","俯瞰・メタ思考","★★","データを俯瞰して、変化をすみやかに察知するとともに、変化が誤差の範囲かどうか判断できる","＊","","◯"
69,9,"データの理解・検証","俯瞰・メタ思考","★★★","複数のデータを多元的かつ大局的に俯瞰して、大きな動きや本質的な事実を見抜くことができる","＊","","◯"
70,10,"データの理解・検証","データ理解","★","どのような知見を得たいのか、目的に即して集計し、データから事実を把握できる","＊","","◯"
71,11,"データの理解・検証","データ理解","★","データから事実を正しく浮き彫りにするために、集計の切り口や比較対象の設定が重要であることを理解している","＊","","◯"
72,12,"データの理解・検証","データ理解","★","普段業務で扱っているデータの発生トリガー・タイミング・頻度などを説明でき、また基本統計量や分布の形状を把握している","＊","",""
73,13,"データの理解・検証","データ理解","★","時系列データとは何か、その基礎的な扱いについて説明できる（時系列グラフによる周期性やトレンドの確認、移動平均の計算など）","","",""
74,14,"データの理解・検証","データ理解","★★","生データを眺めて、どのような切り口で集計・比較すればデータの理解や事実の把握につながるか検討できる","＊","","◯"
75,15,"データの理解・検証","データ理解","★★","扱ったことのない新たなデータに内容の不明な項目があっても、生データの閲覧や集計を通して何の項目かあたりをつけられる","＊","",""
76,16,"データの理解・検証","データ理解","★★","扱っているデータの関連業務の知識と分析目的を踏まえて、どんな説明変数が効きそうか、あたりをつけて洗い出し、構造的に整理できる（変数のグループ化や階層化など）","＊","",""
77,17,"データの理解・検証","データ理解","★★★","データの変化から起きている事象の背景を構造的に推察し、仮説を立て、検証方法を企画実行できる","＊","",""
78,18,"データの理解・検証","データ理解","★★★","データを入手する前に、存在するであろうデータとその分布を想定して基礎俯瞰の方向性やその結果の想定ができ、それを前提とした解析方法の検討・ラフ設計をすることができる","＊","",""
79,19,"データの理解・検証","データ理解","★★★","扱ったことのない新たなデータであっても、ER図やテーブル定義、生データなどを見ることによってデータの発生源や欠損値の意味などのあたりをつけられる","＊","＊",""
80,20,"データの理解・検証","データ粒度","★★","分析目的とデータの量・質を踏まえて、想定されるメッセージと統計的観点から適切な集計単位やサンプリング率を決定できる","＊","",""
81,21,"データの理解・検証","データ粒度","★★★","分析目的とデータの量・質に加えて、想定しているメッセージ、深掘りの方向性・可能性、処理負荷、データ処理フローなども総合的に踏まえた最適な集計単位やサンプリング率を決定できる","＊","＊",""
82,1,"サンプリング","サンプリング","★","標本誤差およびサンプリングバイアス、およびそれぞれの違いについて説明できる","","","◯"
83,2,"サンプリング","サンプリング","★","実験計画法の基本的な3原則（局所管理化、反復、無作為化）について説明できる","","",""
84,3,"サンプリング","サンプリング","★★","調査対象の母集団の規模・特性や調査コストに応じて、多段階抽出法や層化抽出法など適切な標本抽出方法を計画できる","","",""
85,4,"サンプリング","サンプリング","★★","属性数と水準数が決まれば適切な直交表を選択し実験計画ができる","","",""
86,5,"サンプリング","サンプリング","★★","調査に求められる信頼水準・誤差率から必要となるサンプル数を試算できる","","",""
87,6,"データ加工","データクレンジング","★","外れ値・異常値・欠損値とは何かを理解し、指示のもと適切に検出と除去・変換などの対応ができる","","＊","◯"
88,7,"データ加工","データクレンジング","★★","各変数の分布・欠損率などをふまえて、外れ値・異常値・欠損値の対応方針を決定できる","","","◯"
89,8,"データ加工","データ加工","★","標準化とは何かを理解し、適切に標準化が行える","","",""
90,9,"データ加工","データ加工","★","名義尺度の変数をダミー変数に変換できる","","",""
91,10,"データ加工","データ加工","★★","加工データに不具合がないか確認方法を設計し、検証できる（合計値の照合や、分布の確認など）","＊","","◯"
92,11,"データ加工","データ加工","★★★","加工データの統計的な俯瞰によって不具合の早期発見ができるとともに、統計的観点で次ステップの解析に耐えうるデータであるか評価できる","","","◯"
93,12,"データ加工","特徴量エンジニアリング","★","数値データの特徴量化（二値化／離散化、対数変換、スケーリング／正規化、交互作用特徴量の作成など）を行うことができる","","＊",""
94,13,"データ加工","特徴量エンジニアリング","★★","カテゴリデータの特徴量化ができる（ダミー変数化、特徴量ハッシング[カテゴリ数が多い場合の値の割り当て]、ビンカウンティング、バックオフ、最小カウントスケッチ[レアなカテゴリのまとめ処理]など）","","＊",""
95,14,"データ加工","特徴量エンジニアリング","★★","k-means、k近傍法、t-SNEなどを用いた、類似度または非類似度に着目した特徴量を作成できる","","",""
96,15,"データ加工","特徴量エンジニアリング","★★","周期的な意味合いをもつ特徴量を適切な周期の三角関数を用いて変換できる","","",""
97,16,"データ加工","特徴量エンジニアリング","★★","時系列データに対し周期性やトレンドなどを考慮して、階差、移動平均、移動標準偏差、移動最大、移動最小、ラグなどの特徴量を作成できる","＊","",""
98,17,"データ加工","特徴量エンジニアリング","★★","複数のデータセットから、結合や集計などを組み合わせ、有効な特徴量を作成できる（ユーザごとの過去1ヵ月間の購買金額合計など）","＊","","◯"
99,18,"データ加工","特徴量エンジニアリング","★★★","ドメイン知識に基づく洞察から有効な特徴量を効率的に作成できる（類似商品との価格差、借入額と返済額の比など）","＊","",""
100,19,"データ加工","特徴量エンジニアリング","★★★","有用と思われるデータを新たに調達し、既知のデータと組み合わせることで有効な特徴量を作成できる（業界特有なカレンダー、地理空間的な類似度を考慮した集計値など）","＊","",""
101,1,"データ可視化","方向性定義","★","データの性質を理解するために、データを可視化し眺めて考えることの重要性を理解している","＊","","◯"
102,2,"データ可視化","方向性定義","★","可視化における目的の広がりについて概略を説明できる（単に現場の作業支援する場合から、ビッグデータ中の要素間の関連性をダイナミックに表示する場合など）","＊","",""
103,3,"データ可視化","方向性定義","★★","特異点を明確にする、データ解析部門以外の方にデータの意味を正しく伝える、現場の作業を支援するといった可視化の役割・方向性を判別できる","＊","",""
104,4,"データ可視化","方向性定義","★★★","データ量が膨大で構造が捉えにくい場合や、アウトプットが想像しにくい場合であっても、可視化の役割・方向性を判断できる（ビッグデータ中の要素間の関連性をダイナミックに表現する、細部に入りきらずに問に対して答えを出すなど）","","",""
105,5,"データ可視化","軸出し","★","散布図などの軸出しにおいて、目的やデータに応じて縦軸・横軸の候補を適切に洗い出せる","＊","","◯"
106,6,"データ可視化","軸出し","★","積み上げ縦棒グラフでの属性の選択など、目的やデータに応じて適切な層化（比較軸）の候補を出せる","＊","","◯"
107,7,"データ可視化","軸出し","★★","抽出したい意味にふさわしい軸・層化の粒度、順番を考慮して軸のきざみや層化方法を選択できる","＊","","◯"
108,8,"データ可視化","軸出し","★★","膨大な属性を持つテーブルから目的に有用な属性を選択できる","＊","",""
109,9,"データ可視化","軸出し","★★★","非構造データから分析の軸になりうる候補を抽出し、付加すべき属性候補を適切に出せる","＊","",""
110,10,"データ可視化","データ加工","★","サンプリングやアンサンブル平均によって適量にデータ量を減らすことができる","＊","",""
111,11,"データ可視化","データ加工","★","読み取りたい特徴を効果的に可視化するために、統計量を使ってデータを加工できる","","",""
112,12,"データ可視化","データ加工","★★","データの持つ分散量の観点で、高次元のデータを主成分分析（PCA）などにより1～3次元のデータに変換できる","","","◯"
113,13,"データ可視化","データ加工","★★★","高次元の非線形な（高次の曲線、渦状の分布などの）データであっても、適切に1～3次元のデータに圧縮して、特徴（データの総分散量および各データの位置関係）を損なわずに可視化できる","","",""
114,14,"データ可視化","データ加工","★★★","ネットワーク構造、グラフ構造などの表現において、ノードとエッジが増えすぎて特徴抽出が困難であっても、データの絞り込みや抽象度を上げることで適切に可視化できる","","＊",""
115,15,"データ可視化","データ加工","★★★","データ量が膨大（ペタバイト以上）なために、処理しきれず描画できない規模のデータに対しても、適度なデータや情報の抽出（間引き）、クラスター分析などにより可視化しうる状態にデータを加工できる","","＊",""
116,16,"データ可視化","データ加工","★★★","大規模なデータへのリアルタイムな可視化が求められる場合であっても、特異点の抽出や次元圧縮を通じてデータを圧縮し、リアルタイム表示できる","","＊",""
117,17,"データ可視化","データ加工","★★★","大規模なデータへのリアルタイムな可視化が求められる場合であっても、データの分割転送、復元を通じて可視化できる","","＊",""
118,18,"データ可視化","表現・実装技法","★","データ解析部門以外の方に、データの意味を伝えるサインとしての可視化ができる","＊","",""
119,19,"データ可視化","表現・実装技法","★","適切な情報濃度を判断できる（データインク比など）","","",""
120,20,"データ可視化","表現・実装技法","★","不必要な誇張をしないための軸表現の基礎を理解できている（コラムチャートのY軸の基準点は「0」からを原則とし軸を切らないなど）","","","◯"
121,21,"データ可視化","表現・実装技法","★","強調表現がもたらす効果と、明らかに不適切な強調表現を理解している（計量データに対しては位置やサイズ表現が色表現よりも効果的など）","","","◯"
122,22,"データ可視化","表現・実装技法","★","1～3次元の比較において目的（比較、構成、分布、変化など）に応じ、BIツール、スプレッドシートなどを用いて図表化できる","","＊","◯"
