"NO","SubNo","スキルカテゴリ","サブカテゴリ","スキルレベル","チェック項目","BZ","DE","必須スキル"
123,23,"データ可視化","表現・実装技法","★","端的に図表の変化をアニメーションで可視化できる（人口動態のヒストグラムが経年変化する様子を表現するなど）","","",""
124,24,"データ可視化","表現・実装技法","★","1～3次元の図表を拡張した多変量の比較を適切に可視化できる（平行座標、散布図行列、テーブルレンズ、ヒートマップなど）","","",""
125,25,"データ可視化","表現・実装技法","★★","ネットワーク構造、グラフ構造、階層構造などの統計的な関係性の可視化ができる","","＊",""
126,26,"データ可視化","表現・実装技法","★★","地理空間情報などを地図に重ね合わせた可視化ができる（コロプレスマップ、ボロノイ図など）","","",""
127,27,"データ可視化","表現・実装技法","★★","挙動・軌跡の可視化ができる（店舗内でのユーザの回遊やEye tracking、ウェアラブル端末の3軸ジャイロセンサーや心拍数など）","","",""
128,28,"データ可視化","表現・実装技法","★★","適切な情報（意味）を押さえた上で、デザイン性を高めるための要件提示ができる","＊","",""
129,29,"データ可視化","表現・実装技法","★★","ドメイン知識とビジネス背景をふまえ、適切な情報項目を参照し、利用者の使い勝手を考慮した可視化したダッシュボードあるいは可視化ツールを設計できる","＊","＊",""
130,30,"データ可視化","表現・実装技法","★★★","人体、標高を持つ地図、球面など３次元空間上にデータを重ね合わせた可視化ができる","","＊",""
131,31,"データ可視化","表現・実装技法","★★★","地図上で同時に動く数百以上のポイントにおける時間変化を動的に表現できる（多地点での風の動き、飛行物の軌跡など）","","＊",""
132,32,"データ可視化","表現・実装技法","★★★","複雑で総合的な表現が求められる場合に、ユーザインターフェースの設計に加え、内部のアルゴリズム設計やシステム環境への負荷調整なども踏まえた可視化ができる","","＊",""
133,33,"データ可視化","意味抽出","★","外れ値を見出すための適切な表現手法を選択できる","","",""
134,34,"データ可視化","意味抽出","★","データの可視化における基本的な視点を挙げることができる（特異点、相違性、傾向性、関連性を見出すなど）","","","◯"
135,35,"データ可視化","意味抽出","★★","統計値（代表値の指標、バラツキの指標、有意性の指標、関係式）を正しく読み、回帰式や移動平均線に意味付けできる","","","◯"
136,36,"データ可視化","意味抽出","★★★","分類・グルーピングの分析において、分布傾向から原因を追究し、活用方針を計画・主導できる（分類に応じたDM発送による反応率の向上など）","＊","",""
137,37,"データ可視化","意味抽出","★★★","予測の分析において、関連性、特異点、変曲点から原因を追究し、活用方針を計画・主導できる（予測結果に基づく発注管理など）","＊","",""
138,38,"データ可視化","意味抽出","★★★","関係性の分析において関連が高い/低い原因を追究し、活用方針を計画・主導できる（レコメンドなど）","＊","",""
139,1,"予測","回帰・分類","★","単回帰分析において最小二乗法、回帰係数、標準誤差、決定係数を理解し、モデルを構築できる","","","◯"
140,2,"予測","回帰・分類","★","重回帰分析において偏回帰係数と標準偏回帰係数、重相関係数について説明できる","","",""
141,5,"予測","回帰・分類","★","線形回帰分析は量的な変数を予測し、ロジスティック回帰分析は二値の質的な変数を予測する手法であることを説明できる","","",""
142,3,"予測","回帰・分類","★★","重回帰分析や判別分析を実行する際に変数選択手法の特徴を理解し、適用できる","","",""
143,4,"予測","回帰・分類","★★","重回帰分析において多重共線性の評価ができ、適切に変数を統合・加工・削除して予測モデルが構築できる","","","◯"
144,6,"予測","回帰・分類","★★","過学習を防止するためにL1正則化（Lasso）、L2正則化（Ridge）、それらを組み合わせたElastic netを適用できる","","",""
145,7,"予測","回帰・分類","★★","一般化線形モデル (GLM) および一般化線形混合モデル（GLMM）を用いて分布形状に応じたモデルを構築できる","","",""
146,9,"予測","回帰・分類","★★","ロジスティック回帰分析において回帰係数とオッズ比の関係について説明できる","","",""
147,10,"予測","回帰・分類","★★","ロジスティック回帰分析を行う際に、最小二乗法ではなく最尤法を使う際の利点（回帰誤差が近似的に正規分布しなくても適用できるなど）を説明し、適用できる","","",""
148,11,"予測","回帰・分類","★★","Cox回帰（比例ハザードモデル）を用いて対象イベントの発生確率を予測する生存分析モデルを構築できる","","",""
149,12,"予測","回帰・分類","★★","対象の個体差やグループ毎の差が認められるデータに対し、階層ベイズモデルの構築ができる","","",""
150,13,"予測","回帰・分類","★★","予測アルゴリズムに応じ、必要な変数加工処理を設計し、実施できる（標準化やダミー変数化など、採用したアルゴリズムに適した変数加工）","","",""
151,8,"予測","回帰・分類","★★★","対象データの分布をみて、分布形状に適合した計算式の非線形回帰モデルを構築できる","","",""
152,14,"予測","回帰・分類","★★★","予測モデル構築において頑健性（Robustness）を維持するための具体的な方法を設計、実施できる","","","◯"
153,15,"予測","評価","★","ROC曲線、AUC(Area under the curve)、を用いてモデルの精度を評価できる","","",""
154,16,"予測","評価","★","混同行列（正誤分布のクロス表）、Accuracy、Precision、Recall、F値、macro平均、micro平均、重み付き平均といった評価尺度を理解し、精度を評価できる","","",""
155,18,"予測","評価","★","RMSE（Root Mean Square Error）、MAE（Mean Absolute Error）、MAPE（Mean Absolute Percentage Error）、決定係数といった評価尺度を理解し、精度を評価できる","","","◯"
157,19,"予測","評価","★★","不均衡データ（Imbalanced data）に対する分類モデルの評価尺度を、Precision、Recall、F値、PR（Presicion Recall）曲線、マシューズ相関係数などを用いてビジネス課題に合わせて適切に設定できる","＊","",""
158,21,"予測","評価","★★★","MSE、AUC、F値などは評価データ全体に対する平均的評価であることを理解し、必要に応じて予測値・誤差の可視化、データの部分集合に対する評価などを実施できる","","",""
160,20,"予測","評価","★★★","目的（予測・真のモデル推定など）に応じて、適切な損失関数とモデル選択基準（AIC：赤池情報量規準、BIC：ベイズ情報量規準、MDL：最小記述長など）を選択し、モデル評価ができる","","",""
161,23,"学習","機械学習","★","機械学習にあたる解析手法の名称を3つ以上知っており、手法の概要を説明できる","","",""
162,24,"学習","機械学習","★","機械学習のモデルを使用したことがあり、どのような問題を解決できるか理解している（回帰・分類、クラスター分析の用途など）","","",""
163,25,"学習","機械学習","★","「教師あり学習」「教師なし学習」の違いを理解している","","","◯"
164,26,"学習","機械学習","★","過学習とは何か、それがもたらす問題について説明できる","","","◯"
165,27,"学習","機械学習","★","次元の呪いとは何か、その問題について説明できる","","",""
166,28,"学習","機械学習","★","教師あり学習におけるアノテーションの必要性を説明できる","＊","",""
167,29,"学習","機械学習","★","観測されたデータにバイアスが含まれる場合や、学習した予測モデルが少数派のデータをノイズと認識してしまった場合などに、モデルの出力が差別的な振る舞いをしてしまうリスクを理解している","","","◯"
168,30,"学習","機械学習","★","機械学習における大域的(global)な説明（モデル単位の各変数の寄与度など）と局所的(local)な説明（予測するレコード単位の各変数の寄与度など）の違いを理解している","","",""
169,31,"学習","機械学習","★","ホールドアウト法、交差検証（クロスバリデーション）法の仕組みを理解し、学習データ、パラメータチューニング用の検証データ、テストデータを作成できる","","",""
170,32,"学習","機械学習","★","時系列データの場合は、時間軸で学習データとテストデータに分割する理由を理解している","","",""
171,33,"学習","機械学習","★","機械学習モデルは、データ構成の変化(データドリフト)により学習完了後から精度が劣化していくため、運用時は精度をモニタリングする必要があることを理解している","","",""
172,42,"学習","機械学習","★","ニューラルネットワークの基本的な考え方を理解し、出力される「ダイアグラム」の入力層、隠れ層、出力層の概要と、活性化関数の重要性を理解している","","","◯"
173,43,"学習","機械学習","★","決定木をベースとしたアンサンブル学習（Random Forest、勾配ブースティング[Gradient Boosting Decision Tree：GBDT]、 その派生形であるXGBoost、LightGBMなど）による分析を、ライブラリを使って実行でき、その結果を正しく解釈できる","","",""
176,34,"学習","機械学習","★★","学習データ、検証データ、テストデータの分割時にデータの性質や目的に応じて、地理空間情報や様々な属性を考慮すべきか判断できる","＊","",""
177,35,"学習","機械学習","★★","予測モデルにおけるリークとは何か、それがもたらす問題について説明できる","","",""
178,38,"学習","機械学習","★★","次元の呪いの影響を受けやすいアルゴリズムを識別し対処するアプローチを知っている（特徴量選択、次元圧縮、L1/L2正則化など）","","",""
179,39,"学習","機械学習","★★","アノテーションにおいて、判断基準の明確化やアノテーターの精度管理を適切に実施することにより、高品質な教師付きデータを効率的に作成できる","＊","",""
180,40,"学習","機械学習","★★","教師あり学習と強化学習の違いを、前提、定義、応用先といった観点で説明できる","","",""
181,41,"学習","機械学習","★★","決定木分析においてCHAID、C5.0、CARTなどのデータ分割のアルゴリズムの特徴を理解し、適切な方式を選定できる","","",""
182,44,"学習","機械学習","★★","データに変更を加え予測モデルを故意に誤らせる敵対的サンプル（Adversarial examples）について、代表的な攻撃方法を理解している","","",""
183,46,"学習","機械学習","★★","生成モデルと識別モデルの違いやそれぞれのメリットを理解しており、目的に応じて適切に使い分けられる","","",""
184,47,"学習","機械学習","★★","不均衡データ（Imbalanced data）がモデルに与える影響を理解し、サンプリングや評価/損失関数のチューニングなどを適切に対処できる","","",""
185,48,"学習","機械学習","★★","バイアスとバリアンスの関係について、未学習や過学習の観点から説明できる","","",""
186,49,"学習","機械学習","★★","機械学習・AIの公平性の評価指標について説明できる（デモグラフィックパリティ、均等オッズなど）","＊","",""
187,50,"学習","機械学習","★★","LIME、SHAPなどを用いて、ブラックボックス性の高いモデルの局所的な説明（レコード単位の予測根拠の提示）ができる","","",""
188,54,"学習","機械学習","★★","課題やデータに応じて、汎化性能向上のためのデータ拡張（Data Augmentation）を設計・実装できる（画像データの回転・反転、テキストデータの単語入れ替え・置換・削除など）","","",""
192,37,"学習","機械学習","★★★","データと分析要件から、データ分布やモデル精度のモニタリング設計・実施と、劣化が見込まれるモデルに対するリモデルの設計ができる","","＊",""
193,36,"学習","機械学習","★★★","リークの発生の有無を適切に判断し、対応できる（マスタデータが更新されており、本来予測時に使用できない未来の情報を含んでしまうパターン、本来は未知である評価データも含めて標準化するパターンなど）","＊","",""
194,45,"学習","機械学習","★★★","最新の研究に基づき敵対的サンプル（Adversarial examples）に対する現実的な対策を検討できる","","",""
195,51,"学習","機械学習","★★★","分析要件に応じ、モデリング手法（線形モデル、決定木、サポートベクターマシン、ニューラルネットワーク、アンサンブル学習など）の選択とパラメータ設定、結果の評価、チューニングを適切に設計・実施・指示できる","","","◯"
196,52,"学習","機械学習","★★★","複数の機械学習モデルを組み合わせるアンサンブル学習において、各モデルの予測スコアを用いた平均（Averaging）、多数決（Voting）、Stackingなどの手法を理解し、目的に応じて設計・実装できる","","＊",""
197,53,"学習","機械学習","★★★","半教師あり学習やアクティブラーニングにより効率的なアノテーションができる","＊","",""
198,55,"学習","機械学習","★★★","機械学習等の最新の論文を理解し、必要とあれば自分で実装し評価できる","","＊",""
201,63,"学習","深層学習","★","深層学習（ディープラーニング）モデルの活用による主なメリットを理解している（特徴量抽出が可能になるなど）","","","◯"
203,64,"学習","深層学習","★★","バッチ勾配降下法（バッチ学習）、確率的勾配降下法（オンライン学習）、ミニバッチ勾配降下法（ミニバッチ学習）の違いを説明できる","","",""
204,65,"学習","深層学習","★★","ドロップアウト、L1/L2正則化などによる過学習の抑制や、バッチ正規化による学習の効率化について理解している","","",""
205,66,"学習","深層学習","★★","文字や単語といった質的（離散的）な特徴量をニューラルネットワークで学習する場合、特徴量の各値にベクトルを対応させるEmbeddingが有効であることを理解している","","",""
206,67,"学習","深層学習","★★","畳み込みニューラルネットワーク(CNN)、再帰型ニューラルネットワーク（RNN）、長期短期記憶（LSTM）、Transformerなどの深層学習の主要方式の特徴を理解し、目的に応じて適切に選定できる","","",""
207,68,"学習","深層学習","★★","ニューラルネットワークにおいてAttention機構の特徴を理解し、各ベクトルの重みを算出できる","","",""
208,69,"学習","深層学習","★★","転移学習とファインチューニングの基本的な枠組みを理解し、事前学習済みのニューラルネットワークを用いた効率的な学習方法を設計・実装できる","","＊",""
209,70,"学習","深層学習","★★","誤差逆伝播法（Backpropagation）における勾配消失、勾配爆発の問題を理解し、適切な活性化関数・重みの初期化方法の選択、Gradient Clippingなどの緩和策を実施できる","","",""
210,71,"学習","深層学習","★★","Residual Connection(Skip Connection)が誤差逆伝播法（Backpropagation）における勾配消失問題の緩和策となっていることを理解している","","",""
211,72,"学習","深層学習","★★","深層学習における最適化法/Optimizer（SGD、Momentum、RMSProp、Adamなど）や学習率の動的な調整法（Cyclical Learning Rateなど）の重要性について理解している","","",""
212,75,"学習","深層学習","★★","主要な深層生成モデル（変分自己符号化器[Variational AutoEncoder： VAE]、敵対的生成ネットワーク[Generative Adversarial Network：GAN]）やその派生形を理解し、目的に応じて学習・評価できる","","",""
214,73,"学習","深層学習","★★★","深層学習の実装において、予想精度を向上するため、層の種類（全結合、畳み込み、プールなど）、層数、ニューロン数、活性化関数、学習率、学習回数などをチューニングできる","","",""
215,74,"学習","深層学習","★★★","深層学習モデルの推論時の計算コストを削減する方法（枝刈り、蒸留、量子化など）を設計・実装できる","","",""
217,79,"学習","強化学習","★★","状態と行動、報酬による強化学習の基本概念を理解し、モンテカルロ法やQ学習などを実行できる","","",""
218,80,"学習","強化学習","★★★","主要な強化学習モデルを理解し、目的に応じて学習・評価できる(Deep Q-network [DQN]、Asynchronous Advantage Actor-Critic[A3C]、Proximal Policy Optimization [PPO]やその派生形など）","","",""
219,81,"時系列分析","時系列分析","★","時系列分析を行う際にもつべき視点を理解している（長期トレンド、季節成分、周期性、ノイズ、定常性など）","","",""
220,82,"時系列分析","時系列分析","★★","時系列データの時点間での関係を、自己相関やコレログラムを利用して評価ができる","","",""
221,83,"時系列分析","時系列分析","★★","時系列データに対し、ライブラリを使用して、分析結果の比較を行い、適切なモデルを選択できる（自己回帰モデル[AR]、移動平均モデル[MA]、ARIMA、SARIMA、VAR、GARCH、Prophet、指数平滑法など）","","",""
222,84,"時系列分析","時系列分析","★★","グレンジャー因果などの手法を用い、時系列データにおける変数間の因果関係を把握できる","","",""
223,85,"時系列分析","時系列分析","★★","高速フーリエ変換（Fast Fourier Transform: FFT）などを用いてピリオドグラムの計算量を抑制できる","","",""
224,86,"時系列分析","時系列分析","★★","時系列データにおいて、前埋め/線形補完/移動平均などの手法を用い欠測値の補完を行うことができる","","",""
225,87,"時系列分析","時系列分析","★★★","状態空間モデルにおいて、カルマンフィルタを用いた欠測値の補完や予測モデルの構築ができる","","",""
226,88,"時系列分析","時系列分析","★★★","非線形・非ガウス型状態空間モデルにおいて、モンテカルロ・フィルタを用いて、複雑な時系列システムの予測モデルを構築できる","","",""
227,89,"グルーピング","グルーピング","★","教師なし学習のグループ化（クラスター分析）と教師あり学習の分類（判別）モデルの違いを説明できる","","",""
228,90,"グルーピング","グルーピング","★","階層クラスター分析と非階層クラスター分析の違いを説明できる","","",""
229,91,"グルーピング","グルーピング","★","階層クラスター分析において、デンドログラムの見方を理解し、適切に解釈できる","＊","",""
230,92,"グルーピング","グルーピング","★★","非階層クラスター分析において、分析対象となるデータの特性や分析目的に応じ、適切なクラスター数を決定できる","","","◯"
231,93,"グルーピング","グルーピング","★★","階層クラスター分析における代表的なクラスター間距離（Ward法、群平均法、最長一致法など）の概念を理解し、目的に合致した最適な手法で分析できる","","",""
232,94,"グルーピング","グルーピング","★★","クラスター分析を実行する際、各種距離関数（ユークリッド距離、マンハッタン距離、マハラノビス距離など）を理解し、分析目的に合致した最適な距離計算で分析できる","＊","",""
233,95,"グルーピング","グルーピング","★★","k-means法で得られる分析結果は局所最適解であるため初期値問題があることを理解し、適切な初期値を選択できる","","",""
234,96,"グルーピング","グルーピング","★★","k-meansやその派生方法、カーネルk-means、スペクトラルクラスタリングなどの違いを理解し、試行の中で最適な手法を選択・実行できる","","",""
235,97,"グルーピング","グルーピング","★★★","自己組織化マップ（SOM）、Affinity Propagation、混合分布モデル、ディリクレ過程混合モデルなどを理解し、試行の中で最適な手法を選択できる","","",""
236,98,"性質・関係性の把握","グラフィカルモデル","★★","グラフィカルモデルを用いて、確率変数間の関係性をグラフ表現できる","","",""
237,99,"性質・関係性の把握","グラフィカルモデル","★★","重回帰分析とパス解析の違いを説明できる","","",""
238,100,"性質・関係性の把握","グラフィカルモデル","★★","ベイジアンネットワーク分析結果から目的事象の事後確率を算出できる","","",""
239,101,"性質・関係性の把握","グラフィカルモデル","★★","共分散構造分析（構造方程式モデリング：SEM）を行い、観測変数・潜在変数の因果関係を説明できる","","",""
245,1,"グルーピング","異常検知","★★","手元のデータの多寡やデータの再現性をふまえ、教師あり異常検知と教師なし異常検知の違いを適切に使い分けることができる","＊","",""
246,2,"グルーピング","異常検知","★★","Local Outlier Factor（LOF）、オートエンコーダ、One-class SVM（Support Vector Machine）、マハラノビス距離などを用いた異常検知の手法を理解し、試行の中で最適な手法を選択・実行できる","","",""
248,4,"パターン発見","パターン発見","★★","分析要件から適切なレコメンドアルゴリズム（協調フィルタリング、コンテンツベースフィルタリング、Factrization Machineなど）を選定できる","","",""
249,5,"パターン発見","パターン発見","★★★","行動履歴に加え、アイテム属性、ユーザ属性、時間変化などの情報を用いて、目的に応じた推薦アルゴリズムを実装・評価できる","","",""
250,1,"自然言語処理","自然言語処理","★","テキストデータに対する代表的なクリーニング処理（小文字化、数値置換、半角変換、記号除去、ステミングなど）を目的に応じて適切に実施できる","","＊",""
251,2,"自然言語処理","自然言語処理","★","形態素解析や係り受け解析のライブラリを適切に使い、基本的な文書構造解析を行うことができる","","",""
252,3,"自然言語処理","自然言語処理","★","自然言語処理を用いて解けるタスクを理解し、各タスクの入出力を説明できる（GLUEタスクや固有表現抽出、機械翻訳など）","","",""
253,4,"自然言語処理","自然言語処理","★★","Unigram laguage modelやBPE（Byte Pair Encoding）によるサブワード分割手法を理解しており、必要に応じて適切に実施できる","","",""
254,5,"自然言語処理","自然言語処理","★★","使用メモリの削減やモデルの精度向上のため、名寄せやユーザ定義辞書の作成、ストップワードの除去・置換を実施できる","","",""
255,6,"自然言語処理","自然言語処理","★★","Word2Vec（Skip-gram、CBoW）などの分散表現（ベクトル表現）モデルを理解し、使いこなせる","","",""
