"NO","SubNo","スキルカテゴリ","サブカテゴリ","スキルレベル","チェック項目","BZ","DE","必須スキル"
256,7,"自然言語処理","自然言語処理","★★","TF-IDFやcos類似度などの基本的なアルゴリズムを使い、文書ベクトルの作成や文書間の類似度を計算できる","","",""
257,8,"自然言語処理","自然言語処理","★★★","形態素解析・構文解析・固有表現抽出のアルゴリズムを理解し、使いこなせる","","",""
258,9,"自然言語処理","自然言語処理","★★★","N-gram言語モデルの構築方法と代表的なスムージングアルゴリズムを理解し、使いこなせる","","",""
259,10,"自然言語処理","自然言語処理","★★★","索引型の全文検索の仕組み（転置インデックス、スコアリング、関連性フィードバック）を理解し、使いこなせる","","＊",""
260,12,"自然言語処理","自然言語処理","★★★","主要なトピックモデル（確率的潜在意味解析[pLSA]、潜在的ディリクレ配分法[LDA]）の仕組みを理解し、使いこなせる","","",""
261,13,"自然言語処理","自然言語処理","★★★","データの特性に合わせ、適切な言語処理アルゴリズムを選択し、誤り分析、辞書作成などを行い、成果を最大化できる","","",""
262,14,"自然言語処理","自然言語処理","★★★","再帰型ニューラルネットワーク（RNN）、長期短期記憶（LSTM）、Transformerなどを用いたニューラル言語モデルを理解し、使いこなせる","","",""
263,15,"自然言語処理","自然言語処理","★★★","隠れマルコフモデル（Hidden Markov Model：HMM）、Conditional Random Fields：CRF）などを用いた系列ラベリング手法を理解し、使いこなせる","","",""
264,16,"自然言語処理","自然言語処理","★★★","GPT（Generative Pre-Trained transformer）、BERT（Bidirectional Encoder Representations from Transformer）などのAttentionベースのニューラル言語モデルを理解し、使いこなせる","","",""
265,17,"画像・映像認識","画像認識","★","画像のデジタル表現の仕組みと代表的な画像フォーマットを知っている","","",""
266,18,"画像・映像認識","画像認識","★","画像に対して、目的に応じた適切な色変換や簡単なフィルタ処理などを行うことができる","","＊",""
267,19,"画像・映像認識","画像認識","★","画像データに対する代表的なクリーニング処理（リサイズ、パディング、正規化など）を目的に応じて適切に実施できる","","＊",""
268,20,"画像・映像認識","画像認識","★★","画像認識を用いて解けるタスクを理解し、入出力とともに説明できる（識別、物体検出、セグメンテーションなど）","","",""
269,21,"画像・映像認識","画像認識","★★","画像の処理や解析において、効果的なパターン検出や画像特徴抽出などを既存手法から選ぶことができる","","＊",""
270,22,"画像・映像認識","画像認識","★★","ResNet、EfficientNet、MobileNetなどの代表的な画像認識モデルを理解し使いこなせる","","",""
271,23,"画像・映像認識","画像認識","★★","ライブラリ、学習済みモデルなどを用いて識別・物体検出・セマンティックセグメンテーションなどの画像処理を実装・評価できる","","",""
272,24,"画像・映像認識","画像認識","★★★","画像・動画処理を行う環境（モバイル上での処理など実行に制約を伴う環境）と処理パフォーマンスを考慮し、適切な手法の選択とモデルの構築ができる","","＊",""
274,26,"画像・映像認識","映像認識","★","動画のデジタル表現の仕組みと代表的な動画フォーマットを理解しており、動画から画像を抽出する既存方法を使うことができる","","",""
275,27,"画像・映像認識","映像認識","★★","物体が動いている方向・速度（オプティカルフロー）を動画から推定し、トラッキングできる","","",""
276,28,"画像・映像認識","映像認識","★★★","動画の解析手法の現況について理解し、専門家とともに実装を検討できる（Kernel Temporal Segmentation[KTS]による動画の映像区間切り分け、動画内の重要度推定によるハイライト作成など）","","",""
277,29,"音声認識","音声認識","★","wavやmp3などの代表的な音声フォーマットの特徴や用途、基本的な変換処理について説明できる（サンプリングレート、符号化、量子化など）","","",""
278,30,"音声認識","音声認識","★★","音声データから、分析目的にあった波形データの抽出やノイズの除去ができる","","＊",""
279,31,"音声認識","音声認識","★★","音声認識や本人認証、感情分析などの代表的な音声処理分野について理解し、用いられる分析手法を説明できる","","",""
280,32,"音声認識","音声認識","★★★","短時間フーリエ分析、メルフィルタバンク処理、ケプストラム分析、LPC（線形予測分析）などの代表的な音声信号分析手法を理解し、使いこなすことができる","","",""
281,33,"音声認識","音声認識","★★★","音声認識、音声合成、認証・感情分析などの目的に合わせて、パラメータ調整や手法変更、言語モデル・音響モデルなどを差し替え、モデル構築・精度評価ができる","","",""
296,1,"シミュレーション・データ同化","シミュレーション・データ同化","★★","離散型・連続型シミュレーションについて、説明できる（モンテカルロ、ヒストリカル、Agentベースなど）","","",""
297,2,"シミュレーション・データ同化","シミュレーション・データ同化","★★","マルコフ連鎖の特徴を理解し、MCMC（マルコフ連鎖モンテカルロ法）シミュレーションをライブラリを用いて実装できる","","",""
298,3,"シミュレーション・データ同化","シミュレーション・データ同化","★★★","データ同化の概念を理解し、実行できる（データを用いてシミュレーション内の不確実性を減少させる計算技法など）","","",""
299,4,"シミュレーション・データ同化","シミュレーション・データ同化","★★★","シミュレーションにおける問題を理解し、対処を考えることができる（初期条件・境界条件・パラメータの不確実性、データ分布の不均一性、実験計画の最適性など）","","",""
300,5,"シミュレーション・データ同化","シミュレーション・データ同化","★★★","MCMC（マルコフ連鎖モンテカルロ法）における各種アルゴリズム（メトロポリス-ヘイスティングス法、ギブスサンプラー、ハミルトニアン・モンテカルロ法など）について理解し、活用できる","","",""
301,6,"最適化","最適化","★★","複数のA/Bテスト、スプリットテストの統計的結果を踏まえ、デザイン等の最適化を実施できる","＊","",""
302,7,"最適化","最適化","★★","一定の制約下で最適解の識別と報酬の最大化がともに求められ、かつ報酬分布が時間経過で変化するような問題に対して、多腕バンディットアルゴリズムを適用・実装できる","","",""
303,8,"最適化","最適化","★★","線形計画法について説明できる","","",""
304,9,"最適化","最適化","★★","凸関数および、凸計画問題の条件や特徴を説明できる","","",""
305,10,"最適化","最適化","★★","連続最適化問題（制約なし）において、使用可能なアルゴリズムを説明できる（ニュートン法、最急降下法など）","","",""
306,11,"最適化","最適化","★★","連続最適化問題（制約あり）において、使用可能なアルゴリズムを説明できる（ラグランジュ未定乗数法、内点法、逐次2次計画法など）","","",""
307,12,"最適化","最適化","★★","組み合わせ最適化問題において、代表的な解法の概念を説明できる（厳密解法（分枝限定法、動的計画法、切除平面法）、近似解法（局所探索、貪欲法など）、メタヒューリスティック解法（遺伝的アルゴリズム、タブーサーチなど））","","",""
308,13,"最適化","最適化","★★★","ビジネス課題にあわせて、変数、目的関数、制約を定式化し、線形・非線形を問わず、最適化モデリングができる","＊","",""
309,14,"最適化","最適化","★★★","代表的な最適化問題に関して、モデリングを行い、ソルバーを使い、最適化できる（ナップザック問題、ネットワークフロー問題、巡回路問題など）","","",""
99999999,11,"データの理解・検証","統計情報への正しい理解","★","単なるローデータとしての実数だけを見ても判断出来ない事象が大多数であり、母集団に占める割合などの比率的な指標でなければ数字の比較に意味がないことがわかっている","","","◯"
99999999,11,"データの理解・検証","統計情報への正しい理解","★","ニュース記事などで統計情報に接したときに、数字やグラフの持つメッセージを理解できる","＊","","◯"
99999999,20,"データの理解・検証","統計情報への正しい理解","★★","自身の判断に必要となる統計情報を積極的に収集するとともに、表現に惑わされず数字を正当に評価できる（原点が0ではないグラフ、不要な3D化、不要な2軸化、目盛りの未記載など）","＊","",""
99999999,14,"データの理解・検証","統計情報への正しい理解","★★★","数字やデータの検証のために、何と比較するべきかすみやかに把握し、収集・利用できる（業務データや過去に接触した統計情報の想起・活用を含む）","＊","",""
99999999,94,"グルーピング","グルーピング","★★★","距離の公理を満たさない場合（1-cos類似度など）においてもクラスター分析を適切に実行できる","","",""
99999999,23,"学習","機械学習","★","ライブラリを使ってサポートベクターマシンによる分析を実行・評価できる","","",""
99999999,9,"自然言語処理","自然言語処理","★★★","Trie、Suffix Arrayなどの代表的な高速文字列検索アルゴリズムを理解し、使いこなせる","","＊",""
99999999,21,"画像・映像認識","画像認識","★★","画像の処理や解析において、既存のAPI化したクラウドサービスなどを目的に即して、選定・活用できる","","",""
99999999,33,"音声認識","音声認識","★"," 目的に応じ音声認識関連のAPIを選択し、適用できる（Speech to Text など）","","",""
